{
	"$schema": "../../../../../Platform/A2v10.App.Assets2026/Application/@schemas/metadata-report-json-schema.json#",
	"surface": "journal/stock",
	"type": "turnover",
	"groups": [ "Store" ],
	"filters": [ "NoSuchColumn" ],
	"data": [ "Qty" ],
	"defaults": {
		"groups": [ "Store" ],
		"data": [ "Qty" ]
	}
}
